{
  "schemaVersion": "1.0",
  "objectType": "WORKSPACE",
  "id": "wsp_01ARZ3NDEKTSV4RRFFQ69G5FAV",
  "slug": "global-public",
  "name": "Global Public Knowledge",
  "dataDomain": "PUBLIC",
  "status": "ACTIVE",
  "defaultLocale": "zh-CN",
  "timezone": "Asia/Shanghai",
  "syncPolicy": {
    "mode": "RAW",
    "allowPublicPromotion": true
  },
  "retentionPolicy": {
    "rawArtifactDays": null,
    "derivedDocumentDays": 3650
  },
  "createdAt": "2026-07-15T16:00:00Z",
  "updatedAt": "2026-07-15T16:00:00Z",
  "extensions": {
    "x-markorbit-purpose": "public-source-poc"
  }
}
